{"artifact_hash":"e78dc5996849a55124f2ae759c3394e3e8666af183b7729cf522a53b96907d09","change_reason":"Initial Stage 0 G9 deterministic fixture freeze.","expected":{"effective_count":6,"gradient_state_sha256":"9830dcfd3cf9ac6bca8faa1fbfaeeb4c41fa442a3710743a19968cab1629a0fe","gradient_summaries":{"embedding.weight":{"l2":0.05907142532113269,"max_abs":0.0366067091623942,"sum":-0.007949690024058015},"projection.weight":{"l2":0.05674390235273904,"max_abs":0.026070098082224526,"sum":0.08482493956883748}},"loss_numerator":6.0171572915278375,"mean_loss":1.002859548587973},"fixture_id":"stage0-tiny-token-lm-v1","generator_source_ref":"src/param_importance_nlp/deterministic_fixture.py","generator_version":"tiny-token-lm-generator-v1","inputs":{"labels":[[2,3,4,-100],[3,2,1,-100]],"sample_ids":["fixture-sequence-0000","fixture-sequence-0001"],"token_ids":[[1,2,3,4],[4,3,2,1]]},"mathematical_semantics":{"ignore_index":-100,"importance_mathematics_implemented":false,"loss":"sum_squared_error_of_labeled_token_logit_to_one_over_non_ignore_labels_divided_by_effective_count","task":"causal_token_prediction_fixture"},"model":{"dtype":"float64","hidden_size":4,"initial_state_sha256":"7821fee3d5f7d4d5af0d705fe2cd8ef12d166d186668569233974ff431f4b417","seed":20260803,"vocab_size":8},"schema_version":"stage0-deterministic-training-fixture-v1","tolerances":{"absolute":1e-07,"relative":1e-06}}
